uid,body,title,url,newspaper_uid,host,n_tokens_title,n_tokens_body
b68a38f4240fb3244933405e4c88bda0,"A principios de los años ochenta a uno lo contrataban de asistente de investigación para construir grandes tablas a lápiz, llenas de cifras económicas con incrementos y porcentajes, en inmensas hojas cuadriculadas. Las calculadoras japonesas que hacían las cuatro operaciones pronto fueron reemplazadas por unas hermosas de Texas Instruments y luego de Hewlett Packard que tenían las funciones trigonométricas, elevaban a cualquier potencia y podían calcular fórmulas. Nos sentíamos más inteligentes y eficaces, pues hacíamos más cosas en menor tiempo y con menos errores.Éramos parte de enormes computadores humanos. Cada uno tenía a cargo un grupo de cálculos específico, que al ser consolidado arrojaba las cuentas empresariales, de ventas, balances y nómina, así como las cuentas nacionales, la balanza de pagos y la cantidad de dinero de un país.Entonces, aparecieron las computadoras, las hojas de cálculo y la capacidad de elaborar complejos modelos. Se volvió obsoleto al papel cuadriculado, el lápiz y las calculadoras. Todo aparecía en una pantalla. Lotus 123 y luego Excel permitían mover columnas y filas a discreción, calcular ecuaciones de casi cualquier nivel de complicación, salvar y compartir en discos. Los programas estadísticos simplificaron enormemente el trabajo.Podíamos dar en minutos respuestas que antes tomaban semanas. Jugábamos con datos y pruebas de hipótesis que solían ser tarea exclusiva de los profesores. Para los estudiantes y asistentes se operó una pequeña revolución, similar a la del revólver en el lejano oeste, que hizo que el tamaño de la persona no importara, pues las máquinas los habían igualado.Estos avances salieron de la capacidad humana de manejar toda la información en forma de ceros y unos, empequeñecer los microchips hasta la nanodimensión y poner en la mano un smartphone que reemplaza todo lo que antes se hacía en la oficina, incluidos libros, revistas académicas indexadas, periódicos, avisos de la esposa y los hijos, concertación de citas, películas, podcasts, reservaciones de aviones, hoteles, restaurantes, compra del mercado familiar, entradas para cines y eventos, en fin, casi la totalidad de la vida humana.Los chips han transformado la vida de todos, pero algo más asombroso es lo que ha sucedido en la vida de los chips. Hoy, para producir el chip más avanzado del mundo se utilizan lásers que golpean 50.000 veces por segundo a una bolita infinitesimal de estaño para pulverizarla a una temperatura varias veces la de la superficie solar y producir así luz extrema ultravioleta, con la cual se imprimen químicos fotosensibles, con un tipo de litografía que crea chips de 13,5 nanómetros. Este tamaño es un centésimo del de la mitocondria y la mitad del coronavirus. La complejidad es sobrecogedora.NewsletterEl análisis de la actualidad y las mejores historias de Colombia, cada semana en su buzónRECÍBALAEl costo de diseñar un chip de este tipo es cientos de millones de dólares. Construir los complejos industriales para ese tipo de litografía cuesta muchos miles de millones de dólares. Solamente Taiwan Semiconductors Manufacturing Company Limited (TSMC) está en este momento en capacidad de hacerlo.En 2021, la industria de chips produjo más transistores que la cantidad combinada de todos los bienes producidos por todas las demás empresas, en todas las demás industrias, en toda la historia humana, según cuenta Chris Miller en el libro Chip War.El sabor del mes es la llamada Inteligencia Artificial Generativa, que es una nueva clase de máquina. Utiliza ese tremendo poder de cómputo para captar los símbolos del lenguaje, la música y la programación, y usarlos de maneras que parecen creativas. Incluso puede ver emociones mejor nosotros, de manera que podrían reemplazar el trabajo de muchas personas.Los llamados ChatGPT y ahora Bard AI Chatbot escarban en cantidades de información y texto prácticamente oceánicas, y adivinan cuál debería ser la siguiente palabra en la frase. Después de unos miles de millones de ciclos de adivinar-comparar-mejorar-adivinar, este enfoque le da un gran poder estadístico a la respuesta y una calidad impresionante al texto que escribe. Si se le plantean bien las preguntas, cosa que requiere iterar con la máquina, se hace evidente que Chat-GPT aprende más rápido, de forma más exhaustiva y aguda que nosotros.Alguien calcula que, para 2025, el 90% del contenido en línea podría ser generado por sistemas de Inteligencia Artificial. Se vaticina que la Inteligencia Artificial podría reemplazar cerca de la mitad de los empleos en Estados Unidos en trabajos de asistentes legales, redactores publicitarios, productores de contenido digital, programadores informáticos y periodistas. Es un acertijo por qué los economistas no son mencionados en estas voces de alarma.Aparecen, sin embargo, varios problemas: los chatbots son como el sabiondo de la oficina, que responde todo supremamente confiado, independientemente de la exactitud de sus fuentes y la calidad de su análisis. En eso es diferente del buscador de Google, que dirige a las personas a otras páginas, no afirma nada sobre su veracidad y deja al observador con la decisión de qué usa y qué no.¿Qué hacer con los sesgos, prejuicios, desinformación y el riesgo de plagio?Mi hijo de 16 años dice que usar ChatGPT no equivale a plagiar, pues no se está copiando a nadie. Opino lo opuesto, pues se estaría uno atribuyendo un trabajo y un producto que es fruto de un esfuerzo de programación de una máquina, unos creadores de algoritmos y una capacidad inusitada de consulta y computación, fuera de nuestro alcance. Por ejemplo, alguien pregunta si AI puede patentar un invento.Ahora bien, por dramáticos que nos parezcan estos cambios en la vida cotidiana y laboral, palidecen frente a los que experimentó la generación de nuestros padres y abuelos, que salieron en mula o a pie de su pueblo en 1925 y tuvieron que conocer el telégrafo, el automóvil, el radio, el agua corriente en baños y cocinas, el cableado eléctrico, la televisión y los aviones, entre muchos otros avances. Esas transformaciones fueron tal vez más dramáticas para ellos de lo que ha sido para nosotros la capacidad de computación, los computadores, smartphones, etc.Lo que le queda difícil a las máquinas es hacerse sus propias preguntas, pues eso necesita propósito. ¿Qué quiero, para qué, cómo y cuándo? La máquina puede ayudar a responder el cómo y el cuándo. Pero el qué es algo que define el ser humano desde sus circunstancias específicas de tiempo, modo y lugar.Acudamos al filósofo austríaco Friedrich A. Hayek, premio Nobel de Economía, quien en su obra más conocida sobre el uso del conocimiento en la sociedad dijo que existe información común e información privada. Cada ser humano es un usuario de información de y sobre los otros, y sobre las cosas que lo rodean. Pero, más crucial, es un productor y generador de información nueva.Mucha de la información que antes era privada está ahora estandarizada y disponible: qué compramos y dónde, qué capta nuestra atención en el celular, dónde vamos por la carretera, con quién conversamos, en fin, todo eso ya lo saben Google, Apple, Facebook, Microsoft, entre otros. Esas empresas comercializan esas cosechas continuas de información para el consumo de todos. Es “conocimiento común”.Pero nadie sabe la duda que me carcome, la idea que acabo de tener, la tecnología que puedo diseñar, el mercado que busco satisfacer. Esas ideas y sensaciones nos llevan a desarrollar un producto, escribir una idea, un teorema, una novela o cantar una nueva canción. Eso es lo que siempre hemos hecho y que ningún computador sabe: cuál es mi propósito, qué busco hoy, qué me motivará mañana o preocupará pasado mañana. Esa es la esencia de la existencia humana. Que ahora se vayan a sumar productos de las máquinas, aumentará el cúmulo de experiencias. Pero no por eso unas reemplazarán a las otras.Como siempre, el destino de cada cual dependerá de la calidad de su información privada, de cómo aprende y mejora, de cuánto eventualmente valdrá su aporte cuando sea pública.La clave no será qué tan bien responde ChatGPT, pues de eso se ocupan miles de ingenieros y trillones de bits de información, computados a una velocidad de 1,000 trillones de cálculos por segundo, como lo hacen los chips de Nvidia (empresa americana) y Biren (China).Lo asombroso es que eso esté ahora ampliamente disponible, con la velocidad, precisión y capacidad de producir textos, imágenes y símbolos. Lo triste sería que no le saquemos el jugo porque no sabemos qué preguntar, o nos quedamos en averiguar frivolidades.Juan Carlos Echeverry es PhD en Economía. Fue ministro de Hacienda de Colombia y CEO de Ecopetrol.Suscríbase aquí a la newsletter de EL PAÍS sobre Colombia y reciba todas las claves informativas de la actualidad del país.",¿Será necesario pensar?,https://elpais.com/america-colombia/2023-03-26/sera-necesario-pensar.html,elpais,elpais.com,2,712
37ece40b580a7e7ecdbe22edcf9a492e,"María Kodama, viuda y heredera universal de Jorge Luis Borges, ha muerto este domingo a los 86 años. La noticia de su fallecimiento ha sido confirmada por su abogado, Fernando Soto, en Twitter: “Ahora entrarás al ‘gran mar’ con tu querido Borges. Que en paz descanses, María”. Traductora y profesora de Literatura, Kodama padecía un cáncer de mama y vivía a las afueras de Buenos Aires. Se había casado con el escritor fundamental de la literatura argentina en abril de 1986, dos meses antes de su muerte, y desde entonces fue la encargada de su obra y legado, que protegió con celo.Tu amigo y  tu abogado te despide. Ahora entrarás al “gran mar” con tu querido Borges. Qué en Paz Descanses María. pic.twitter.com/SkpPE7mw0W— Fernando Soto (@Doctor_Soto) March 26, 2023 Hija de un químico japonés y una argentina, María Kodama nació el 10 de marzo de 1937 y estudió Literatura en la Universidad de Buenos Aires. Se especializó en literatura anglosajona e islandesa, de las que hizo traducciones al español. La adolescente María Kodama escuchó a Borges en una conferencia y tropezó con él en la calle cuando tenía 16 años. Él era 38 años mayor. Le contó que quería estudiar Letras y no se separaron desde entonces. Pero su admiración por el escritor que marcó su vida nació cuando era una niña: a los cinco años, su profesora particular de inglés le hizo memorizar Two English Poems, los únicos poemas que Borges escribió en inglés. Según contó muchas veces, Kodama no sabía quién era el autor, pero guardó desde entonces el final del segundo de ellos: “Puedo darte mi soledad, mi oscuridad, el hambre de mi corazón; Estoy tratando de sobornarte con incertidumbre, con peligro, con derrota”.“Mi madre me decía que Borges podía ser mi abuelo y tenía razón”, contó en una entrevista de mayo de 2021 con la agencia Télam. “Por esa diferencia de edad era una adelantada. Pero, por otro lado, cuando éramos adolescentes, mis amigos hablaban de la familia y los hijos, y yo no quería formar ninguna familia porque mis padres estaban separados y yo, al cuidado de mi abuela. Cuando me hablaban de esposas yo solo conocía a las que se les ponían a los presos. Desde los cinco años, en mi cabeza ya primaba el razonamiento: yo no quería casarme para ser una prisionera y menos tener hijos que me iban a absorber toda la vida, no quería generarme una esclavitud: quería ser libre”.María Kodama y Jorge Luis Borges, durante un paseo en París en 1977.Laurent MAOUS (Gamma-Rapho / Getty Images)Atados desde su adolescencia, firmaron juntos varios libros, entre ellos Breve antología anglosajona, una recopilación de una de sus grandes pasiones conjuntas, la literatura inglesa, y Atlas, un libro de sus viajes publicado en 1984 con las impresiones del escritor, atacado ferozmente por la ceguera que lo acompañó durante décadas, y las notas y fotografías de su compañera. Borges y Kodama recorrieron el mundo desde 1975, cuando hicieron su primer viaje a Estados Unidos, hasta finales de 1985, cuando el escritor fue diagnosticado de un cáncer hepático y se mudaron a Ginebra. Se casaron por poderes en el consulado argentino de Asunción, Paraguay, y Borges la designó su heredera universal.En 1988, Kodama creó la Fundación Internacional Jorge Luis Borges, que presidió hasta su muerte. Como guardiana de la obra de Borges, fue celebrada por pocos por la manera incansable en la que expuso su literatura durante décadas por todo el mundo y criticada por varios por sus incontables litigios legales. El más famoso de ellos, que perdió, fue una demanda contra el escritor Pablo Katchadjian, a quien demandó en 2015 por un supuesto plagio después de que usara el cuento El Aleph para publicar una versión “engordada” que sumaba frases al Borges narrador. No fue el único: también prohibió al francés Jean Pierre Bernès, editor de Borges en la Pléiade de Gallimard, la publicación de 120 cintas de diálogo con el autor antes de su muerte; obligó en 2012 a la editorial Random House a retirar un texto de la mexicana Elena Poniatowska de un recopilatorio sobre la relación del escritor con México por atribuirle erróneamente un poema y criticó con dureza la publicación de Borges, un libro póstumo del mejor amigo del escritor, Adolfo Bioy Casares. “Es una vergüenza, es muy desleal. Si una persona es un amigo, lo que te cuento es secreto de confesión”, le dijo a este diario en 2016 sobre ese retrato íntimo de las miserias y picardías que compartieron dos escritores criados por la aristocracia argentina.En una de sus últimas peleas por la memoria del escritor, llegó a enfrentarse con el actual presidente argentino, Alberto Fernández. En 2019, el mandatario intentó crear un museo para el escritor con el archivo personal de un coleccionista, y Kodama lo desaprobó: denunció entonces que muchos de los objetos que el empresario Alejandro Roemmers iba a donar al Estado eran robados.Más informaciónApuntes sobre María Kodama, por Leila GuerrieroKodama, que también escribió mucho, nunca se animó a publicar su propia ficción mientras Borges vivía. Publicó su primer volumen de cuentos en 2020 y una memoria en 2021. En su autobiografía, que escribió junto al periodista Mario Mactas, se defendió de la sombra que la persiguió durante toda su vida: fue Borges quien había insistido en casarse para nombrarla su heredera, y eso despertaba “la envidia de algunos amigos”.Kodama recordaba al hombre que la obnubiló desde joven y al marido que la celaba, a pesar de que nunca dejó de tratarla de usted. Entre muchas anécdotas, recuerda la temporada en que vieron la película Lawrence de Arabia, protagonizada por Peter O’Toole en 1962, y el escritor criticaba la fascinación de su pareja: “Usted debe estar harta de ver Lawrence de Arabia”, le decía, y Kodama contestaba: “No, Borges, cómo voy a estar harta, al contrario, Peter O’Toole es magnífico y la personalidad de Lawrence es realmente fascinante”. “Pasaron como seis meses y un día me dice que había estado pensando en algo. ‘¿De qué tema?’, le pregunto. ‘Sobre Lawrence. Mire, si usted conociera a un hombre como Lawrence, que es irlandés, y los irlandeses son todos borrachos, usted no podría tener una relación con él porque no ha tomado alcohol en su vida”, contó en una entrevista durante la presentación.Su último libro, publicado hace dos meses, es una semblanza del caudillo bonaerense Juan Manuel de Rosas, que organizó Argentina alrededor de su figura en la primera mitad del siglo XIX. La publicación de esa obra incluye los diálogos que Kodama mantenía sobre Rosas con Borges y es, tal vez, la última ventana a una relación tan comentada como privada. Borges lo llamaba tirano, la “sombra de una montaña lejana”, pero Kodama eligió refutar “la idea de que era un malvado sediento de sangre”.Suscríbase aquí a la newsletter de EL PAÍS América y reciba todas las claves informativas de la actualidad de la región.","Muere la traductora María Kodama, viuda y albacea de Jorge Luis Borges",https://elpais.com/argentina/2023-03-26/muere-maria-kodama-viuda-de-jorge-luis-borges.html,elpais,elpais.com,9,575
141d161e7e2f5ea7634d78ca3b507efc,"La pintora Lucinda Urrusti en su hogar, en Xochimilco, Ciudad de México, en 2022.Claudia AréchigaLos últimos rostros del exilio republicano español en México desaparecen poco a poco. Lucinda Urrusti, pintora de vanguardia y retratista de grandes personalidades de la cultura y la bohemia del Distrito Federal de la época como Gabriel García Márquez, Carlos Fuentes, Octavio Paz o Juan Rulfo, falleció este sábado en la Ciudad de México, según dio a conocer el Ateneo Español.Nacida en 1926 en Melilla, hija de un soldado vasco republicano, dejó España cuando la victoria del bando fascista del general Francisco Franco era inminente. Junto a su familia, se refugió un tiempo en Francia y acabó cruzando el océano en 1939 a bordo del Sinaia, el primer barco que el presidente mexicano Lázaro Cárdenas envió para socorrer a los exiliados españoles. México acabaría acogiendo a 25.000 personas huidas de la Guerra Civil española, según datos de la Agencia de la ONU para los Refugiados (ACNUR).Durante una entrevista con EL PAÍS en mayo del año pasado, a sus 95 años, en la casa de Xochimilco en la que pasó su última etapa, recordaba una vida de película: de tertulias en cafés sobre arte, literatura y política con algunos de los intelectuales más influyentes del momento; de la bohemia de una ciudad convulsa y estimulante; de óleos, tinta y pintura; de aplausos en su casa el 20 de noviembre de 1975, la fecha en que murió Franco.Su pincel inmortalizó los rostros de García Márquez, Fuentes, Paz y Rulfo, pero también al Premio Nobel de la Paz mexicano Alfonso García Robles o la historiadora Beatriz R. de la Fuente. Su estilo rechazó el muralismo que imperaba entonces y se escoró hacia piezas más surrealistas, a veces rozando el impresionismo. La Secretaría de Cultura lamentó en Twitter “el sensible fallecimiento de la pintora Lucinda Urrusti, quien fue parte de la Generación de La Ruptura y cuya obra es referente en el arte contemporáneo de México”.Urrusti nunca quiso volver a vivir a España, ni con la muerte del dictador. Encontró en México un hogar del que solo salió para residir en Nueva York durante una década. Su obra fue admirada por la crítica y sus contemporáneos. Carlos Fuentes escribió de ella: “He seguido el desarrollo artístico de Lucinda Urrusti desde nuestra común juventud (…). La originalidad de Urrusti, pasajera tanto del alba de [Paul] Cézanne como del crepúsculo de [Claude] Monet, es que sus figuras, simultáneamente, tienden a aparecer y desaparecer. (...) Gracias a sus cuadros, evoco ciertas heroicidades españolas, esa grandeza oca y suicida de resistencia, que va del sitio de Numancia al 2 de mayo de Goya, al sitio de Madrid por los fascistas...”.Expuso en el Palacio de Bellas Artes de México y en las galerías de Nueva York. Fue amiga de otros artistas exiliados de la dictadura franquista como Vicente Rojo y Enrique Climent —que llegó a retratarla—. El Instituto Nacional de Bellas Artes y Literatura (INBAL) se ha sumado al duelo por su fallecimiento: “Lamentamos el sensible deceso de la pintora nacionalizada mexicana Lucinda Urrusti, quien estudió en la Escuela Nacional de Pintura, Escultura y Grabado La Esmeralda, del INBAL. Enviamos un abrazo solidario a su familia”.Cuando se casó, vivía junto a su exmarido, el cineasta ya fallecido Archibaldo Burns, en San Ángel. Su vecino era el pintor Juan O’Gorman y ella empezó a frecuentar las reuniones que el artista organizaba en su casa los sábados por la tarde. Acudían novelistas y poetas, pintores y filósofos. “En aquellos tiempos éramos amigos todos, era una época en la que no había gente más importante que otra”, recordaba en la entrevista con este diario.“Importante artista de la generación de la Ruptura, su estilo es considerado postimpresionista. Asimismo, incursionó en el retrato, las pinturas tridimensionales y la escultura”, aseguró el Ateneo Español, de cuya mesa directiva formó parte entre 1995 y 1998. Su sobrino, el cineasta Juan Francisco Urrusti, realizó un documental sobre ella, Lucinda Urrusti. Pintora (2020), que recorre su obra, pero deja fuera episodios de la vida de la artista como la década neoyorquina o la muerte de un hijo antes de cumplir 40 años, un golpe del que, según su familia, nunca se repuso.Sus últimos años los pasó en una casa de piedra de Xochimilco, al sur de la Ciudad de México, llena de flores y árboles que recordaban a un patio andaluz. Cuando EL PAÍS la visitó, la cabeza ya le jugaba malas pasadas y algunos episodios se confundían en su memoria. Conservaba todavía, sin embargo, una mirada limpia de ojos abiertos y una sonrisa radiante que asomaba al recordar sus años de gloria, que sintetizó en una frase: “El mundo era más pequeño, entonces”.Suscríbase aquí a la newsletter de EL PAÍS México y reciba todas las claves informativas de la actualidad de este país","Muere la pintora Lucinda Urrusti, exiliada española y retratista de García Márquez",https://elpais.com/mexico/2023-03-27/muere-la-pintora-lucinda-urrusti-exiliada-espanola-y-retratista-de-garcia-marquez.html,elpais,elpais.com,9,416
