uid,body,title,url,newspaper_uid,host,n_tokens_title,n_tokens_body
30bc781a4c3772470468f0f94e0b5c09,"La familia de las aráceas (Araceae) se precia de tener entre sus parientes a géneros de plantas muy resistentes que cultivamos en los interiores de las casas. Entre esos ilustres miembros cabría citar varios géneros extremadamente populares, en gran parte gracias a su dureza para sobrevivir con iluminaciones medias o incluso bajas: el singonio (Syngonium spp.), el aglaonema (Aglaonema spp.), la zamioculcas (Zamioculcas zamiifolia) o la costilla de Adán (Monstera deliciosa). Todas ellas son muy buenas recomendaciones cuando no se tiene mucha mano verde con el cuidado de las plantas de interior.Otra especie de las aráceas digna de subir a ese podio de plantas muy resistentes es la bandera blanca o espatifilo (Spathiphyllum wallisii), que también recibe otros curiosos nombres como lirio de la paz o cuna de Moisés. Originaria de América Central y de Sudamérica, es una de esas plantas domésticas que se pueden encontrar en infinidad de interiores: hogares, oficinas, restaurantes y cualquier lugar que se haya decidido ajardinar. Su bajo precio, su rapidez de crecimiento y su ubicuidad en todas las floristerías y viveros han potenciado su popularidad, aunada por la facilidad de su cultivo.Más informaciónAspidistra, la planta inmortal típica de las abuelas y la mejor inversión para decorar el rellanoSiempre se tendrá alguna planta que se convierta en una maestra, si es que no lo son todas, pero el espatifilo tiene un don muy desarrollado para enseñar al que no sabe, para instruir con su anatomía al aprendiz. Así relata esas lecciones Milagro Jimena, médico cordobesa y aficionada a las plantas por tradición familiar. Para mesurar su pasión, baste decir que esta especialista de nutrición cuenta entre sus “pacientes” vegetales con un ficus (Ficus elastica) y una esparraguera (Asparagus plumosus) con 42 años y tres mudanzas a cuestas, y con ella que siguen creciendo, tan contentas. “Mi hijo tiene un espatifilo al que llama ‘la planta histérica’ y es porque dice que se pone lacia, histérica, cuando hay que regarla“, cuenta. “Cuando me iba con mi marido de viaje y él se quedaba solo en casa, las primeras veces se la ponía delante de la tele para que no se le olvidara regarla, y cuando estaba lacia, deprimida, la regaba”, relata divertida. En palabras de esta médico, el espatifilo “avisa y revive”, por lo que nos habla con su cuerpo.Es mejor que no se llegue a ese extremo, para evitar que la planta sufra un estrés hídrico que la puede llevar a debilitarse y a contraer enfermedades. Pero en el caso de que ocurra y se mustie delante de nuestros ojos, sabremos cuándo hay que anticiparse a ese riego. Pero, como suele ocurrir en las plantas de interior, es mejor no regar en exceso y no mantener siempre encharcado el sustrato, para evitar fatales pudriciones en sus raíces.En cuanto a la luminosidad, a la bandera blanca le viene muy bien crecer cerquita de una ventana. Podemos incluso probar a cultivarla un poco más en el interior de las habitaciones más luminosas, para ver cómo se adapta. Pero debemos tener en cuenta una cosa: una planta que acabemos de comprar en un vivero vendrá con las mejores condiciones de cultivo que el viverista le haya podido proporcionar. Esto se traduce en una gran cantidad de hojas, y muy probablemente de sus inflorescencias blancas.Lirio de la paz creciendo en maceta. Alberto Orozco / EyeEm (Getty Images)Cuando la llevemos al hogar o a la oficina esas condiciones no serán ya las mismas, por lo que la planta sufrirá una adaptación a su nuevo medio de cultivo. Como es muy posible que la iluminación haya bajado, ya no podrá mantener tantas hojas, por lo que tendrá que reequilibrarse. De esta forma irá perdiendo algunas de las hojas, al no contar con tanta energía lumínica. Lejos de asustarnos, debemos entonces observar y esperar hasta dónde llega esa pérdida. Si vemos que es muy severa, y que incluso deja de florecer, será un claro aviso de que la luz con la que cuenta no es la adecuada, y tendremos que arrimarla a una ventana. En ese reequilibrio por falta de luz más potente puede que las nuevas hojas ya no sean tan grandes como las que traía de la tienda. Pero ahí también puede entrar en juego la falta de nutrición.Al ser una planta muy florífera, unido a su gran capacidad para formar nuevas hojas rápidamente, le vendrá de perlas un abonado orgánico líquido, al menos una vez al mes, si queremos asegurar su robustez y la emisión de más espádices florales y de más de sus alegres hojas. Si prescindimos de esos abonados, como tantas personas hacen, no significa que se nos vaya a morir, pero no lucirá tan exuberante ni mantendrá tanta floración. De hecho, hasta casi podemos olvidarnos de ella y solo recurrir a esos riegos que mantengan el sustrato húmedo cuando lo necesite. Este extremo de planta ruda lo certifica Nena Von Flow, que tiene una empresa de servicios botánicos y que imparte talleres relacionados con ello, y que nos habla del espatifilo de su familia. “Es una planta medio inmortal. Mi madre Encarna no la había trasplantado nunca, y hace unos años se la cambié de maceta. Era heredada de la casa de mi abuela Delia. Nadie la hace ni caso, y ella aguanta y vive sola”, asegura Van Flow.Al ser una planta muy florífera, unido a su gran capacidad para formar nuevas hojas rápidamente, le vendrá de perlas un abonado orgánico líquido, al menos una vez al mes.baranova_ph (Getty Images)Dentro de las muy distintas variedades de espatifilo encontramos desde las de hojas más pequeñas, como la variedad ‘Yess’ o la ‘Chopin’ que no suelen sobrepasar los 50 centímetros de altura, hasta las más grandes como Mauna Loa o Sensation, de hojazas que alcanzan incluso el metro de altura. En consecuencia, podemos encontrarla con el tamaño perfecto para rincones más pequeños o más grandes.Para concluir, no hay que olvidar su aspecto presuntamente depurativo. Gracias a distintos estudios en laboratorio que han utilizado al espatifilo como conejillo de Indias, se le ha puesto la medalla de ser una planta purificadora del aire, debido a su capacidad de fijar compuestos nocivos como el benceno. Maestra y sanadora, la bandera blanca nos aguarda para enseñarnos con su belleza.","Bandera blanca, lirio de la paz y cuna de Moisés: una planta barata, purificadora y que avisa al aprendiz para que la cuide",https://elpais.com/estilo-de-vida/2023-03-26/bandera-blanca-lirio-de-la-paz-y-cuna-de-moises-una-planta-barata-purificadora-y-que-avisa-al-aprendiz-para-que-la-cuide.html,elpais,elpais.com,12,513
a3c2c4dcc008caa36a19120dc2e260b2,"Los riesgos de que la economía mundial vuelva a descarrilar están aumentando. Tras la crisis provocada por la pandemia y el impacto de la guerra de Ucrania, especialmente sobre la inflación, la directora gerente del Fondo Monetario Internacional (FMI), Kristalina Georgieva, ha advertido este domingo en una conferencia en Pekín del aumento de los riesgos para la estabilidad financiera y de los derivados de la fragmentación geopolítica.Sus declaraciones se producen dos semanas después de que la quiebra del Silicon Valley Bank evocase el fantasma de una crisis financiera al contagiarse a otras entidades estadounidenses y europeas. “Es evidente que han aumentado los riesgos para la estabilidad financiera”, ha dicho Georgieva en el China Development Forum en Pekín, según el texto del discurso distribuido por los servicios del FMI en Washington.“En un momento de mayores niveles de deuda, la rápida transición de un periodo prolongado de tipos de interés bajos a tipos mucho más altos, necesarios para luchar contra la inflación, genera inevitablemente tensiones y vulnerabilidades, como demuestra la reciente evolución del sector bancario en algunas economías avanzadas”, ha añadido.El presidente de la Reserva Federal de Estados Unidos, Jerome Powell; la del Banco Central Europeo, Christine Lagarde, y otros banqueros centrales han acometido las subidas de tipos de interés más agresivas en décadas para luchar contra la subida de precios. En Estados Unidos, el alza de tipos ha generado minusvalías latentes de cientos de miles de millones de dólares en la cartera de bonos del Tesoro de las entidades financieras. Esas pérdidas fueron uno de los detonantes de la fuga de depósitos que hizo caer al Silicon Valley Bank.Georgieva ha añadido que “los responsables políticos han actuado con decisión en respuesta a los riesgos para la estabilidad financiera, y los bancos centrales de las economías avanzadas han aumentado la provisión de liquidez en dólares estadounidenses”. Según la directora gerente del FMI, “estas medidas han aliviado en cierto modo las tensiones del mercado, pero la incertidumbre es elevada, lo que subraya la necesidad de mantener la vigilancia”.El FMI, ha explicado, está vigilando de cerca la evolución de la situación y sus posibles repercusiones en las perspectivas económicas y la estabilidad financiera del mundo. El Fondo está prestando especial atención a los países más vulnerables, en particular a los de renta baja con elevados niveles de deuda. El organismo ofrecerá una evaluación detallada en su próximo informe sobre las Perspectivas de la Economía Mundial, que se publicará en las próximas semanas, durante las reuniones de primavera del Fondo, que se celebrarán en Washington.En enero, y por primera vez en más de un año, el Fondo se atrevió a elevar su  previsión de crecimiento de la economía mundial para 2023, aunque fueran solo dos décimas, hasta el 2,9%. Cuando este domingo ha intervenido, Georgieva ha pronosticado que “2023 será otro año difícil, con una ralentización del crecimiento mundial por debajo del 3%, ya que las secuelas de la pandemia, la guerra de Ucrania y la restricción monetaria pesan sobre la actividad económica”. Incluso con mejores perspectivas para 2024, el crecimiento mundial se mantendrá muy por debajo de su media histórica del 3,8%. La previsión que el Fondo publicó en enero fue del 3,1% para el año próximo.División en bloquesNo solo la estabilidad financiera preocupa a Georgieva: “Las incertidumbres son excepcionalmente elevadas, entre otras cosas, por los riesgos de fragmentación geoeconómica que podrían suponer la división del mundo en bloques económicos rivales”, ha dicho.La directora gerente del FMI, que intervenía en Pekín, no se ha extendido sobre esa división, en gran medida una rivalidad geopolítica entre Estados Unidos y China como superpotencias que está aumentando el proteccionismo y el nacionalismo económico. Georgieva sí ha señalado que esa fragmentación geoeconómica es “una división peligrosa que dejaría a todos más pobres y menos seguros”.No todo ha sido pesimismo. “Afortunadamente, las noticias sobre la economía mundial no son del todo malas. Podemos ver algunos brotes verdes, también en China”, ha dicho, utilizando una expresión que hizo fortuna en Estados Unidos en la salida de la crisis financiera, pero que se volvió contra quienes la pronunciaron en algunos países de Europa, que sufrieron una segunda andanada con la crisis del euro.En China, ha dicho Georgieva, la economía está experimentando un fuerte repunte, y las previsiones de enero del FMI sitúan el crecimiento del PIB en el 5,2% este año, un considerable aumento de más de dos puntos porcentuales con respecto a la tasa de 2022. El motor de este crecimiento es el repunte previsto del consumo privado, ya que la economía se ha reabierto y la actividad se ha normalizado.“Esto es importante para China y para el mundo. El fuerte repunte significa que China representará alrededor de un tercio del crecimiento mundial en 2023, lo que supondrá un bienvenido impulso para la economía mundial. Y más allá de la contribución directa al crecimiento mundial, nuestro análisis muestra que un aumento de un punto porcentual en el crecimiento del PIB en China conduce a un aumento de 0,3 puntos porcentuales en el crecimiento de otras economías asiáticas, en promedio, un impulso bienvenido”, ha añadido.Sigue toda la información de Economía y Negocios en Facebook y Twitter, o en nuestra newsletter semanalLa agenda de Cinco DíasLas citas económicas más importantes del día, con las claves y el contexto para entender su alcance.RECÍBELO EN TU CORREO",La directora del FMI advierte del aumento de los riesgos para la estabilidad financiera,https://elpais.com/economia/2023-03-26/la-directora-del-fmi-advierte-del-aumento-de-los-riesgos-para-la-estabilidad-financiera.html,elpais,elpais.com,7,428
238212cc24a860ab991f629842d675fa,"En un bazar de Salou, donde Víctor y sus amigos fueron a celebrar que habían terminado la selectividad, había bebidas, alimentos variados, aperitivos de todo tipo y vapeadores. Compraron unas cervezas para tomar en la playa y decidieron probar también este dispositivo, similar a un cigarrillo electrónico. Desde entonces, se ha convertido en habitual para él cada vez que sale de fiesta. “Sé que es malo para la salud, pero creo que lo puedo controlar. Tabaco nunca fumaría, me da más respeto”, confiesa.El vapeador y el cigarrillo electrónico (dos dispositivos que sirven para inhalar un aerosol con sustancias variadas, con o sin nicotina) van mostrando cada vez más efectos perniciosos, que van desde el daño que hacen las micropartículas que se inhalan en el sistema respiratorio, hasta enfermedades cardiovasculares o mayor riesgo de cáncer. A falta de más tiempo de estudio sobre sus efectos, la evidencia no lo equipara al tabaco tradicional, uno de los mayores problemas de salud pública en el mundo. Pero la regulación más laxa para estos nuevos productos en España está permitiendo a la industria llegar a un sector de población joven, una generación que la Unión Europea pretende que viva libre de tabaco.Es frecuente ver promociones de estos dispositivos en festivales de música, hay campañas en redes sociales en las que participan influencers con un público muy joven entre el que abundan adolescentes, y se pueden encontrar en tiendas de todo tipo, adornados con colores atractivos y anunciados con aromas dulces que recuerdan a golosinas. No hay mucho disimulo en la estrategia de fomentar este producto perjudicial para la salud entre la población más joven.Los datos dicen que lo están consiguiendo. Aunque la última Encuesta sobre uso de drogas en enseñanzas secundarias en España (Estudes), publicada en 2022, muestra una pequeña caída en el consumo con respecto a 2019, indica que el 44% de los adolescentes de entre 14 y 18 años había probado los cigarrillos electrónicos, lo que supone más del doble que en 2016. La mayoría de los estudiantes que vapean se decantan por cartuchos sin nicotina (60,7%), el 14,9% prefieren los que sí llevan, y el 24,4% utiliza de los dos tipos.Uno de los discursos que ha esbozado la industria del vapeo y el cigarrillo electrónico (que a menudo es también la tabaquera) es que los dispositivos están sobre todo pensados para quien fuma, incluso para ayudar a dejarlo, y no para atraer a nuevos adeptos. La Unión de Promotores y Empresarios del Vapeo (UPEV), que aglutina 600 pequeñas y medianas empresas y que registró en 2022 un récord en el negocio (95 millones de euros), asegura que su vocación es la de ayudar a la cesación tabáquica y tiene entre sus buenas prácticas “intentar disuadir a los no fumadores de que compren un dispositivo, aun cuando soliciten que sea sin nicotina”.Tienda de cigarrillos electrónicos y vapeo en Santiago de Compostela.ÓSCAR CORRALBlu, una filial de Imperial Tobacco que se denomina líder en el sector del cigarrillo electrónico, responde —a preguntas de EL PAÍS— que se dirige “exclusivamente a consumidores adultos” y que sus campañas “se llevan a cabo solo en los soportes y canales que permite la normativa vigente y en los términos que contempla la legislación”. “Aunque aún estamos lejos de las cifras de países de nuestro entorno como Reino Unido, Francia o Alemania, son muchos los fumadores que han decidido reducir o abandonar el tabaco convencional gracias al vapeo. Concretamente, el último estudio de Edades afirma que cerca del 45% de los usuarios de cigarrillos electrónicos utilizan estos dispositivos como sustitutivo del tabaco”, señala un portavoz de la compañía.Esto no es así entre los más jóvenes. La encuesta Estudes señala que solo un 8,5% de los estudiantes que han fumado cigarrillos electrónicos manifiestan que su intención era reducir su consumo de tabaco o dejar de fumarlo. En el sondeo que menciona Blu (Edades), que aborda una mayor franja de edad, se comprueba que únicamente dos de cada 10 jóvenes de entre 15 y 24 años que vapean lo hacen motivados por dejar de fumar.Entre las campañas de Blu en redes sociales se pueden encontrar promociones con influencers que se dirigen a un público muy joven, con muchos adolescentes entre sus seguidores, que promocionan el cigarrillo electrónico. Esto publicaba (sin las tildes bien puestas) hace unos meses Telmo Trenado en su perfil de Instagram, con 150.000 seguidores: “SORTEO!! Quieres irte de viaje por Europa con quien tú quieras y que os pille un fotógrafo de Tik Tok infraganti??? Pues participa y llévate un Waynabox así. Dale like al post. Sigue a @bluspain y a mí”.        View this post on Instagram            A post shared by Telmo Trenado (@telmotrenado) Campañas similares se pueden ver en perfiles de otros influencers con miles de seguidores, como Jorge Amor, Fer López, Paula Gureta o Bertuss, entre muchos otros. En el perfil de este último, un usuario le respondía: “No sé si publicitar tabaco a público joven (muchos menores de edad) es muy legal o ético, la verdad. Ya tienes un seguidor menos”. Otro añadía: “Tío mira que me encantas, pero ojalá no hubieras hecho publi de esto. Creo que eres un referente muy guay para mucha gente y muchos jóvenes, pero creo que con esta campaña estás publicitando un producto nocivo para la salud y no creo que sea la mejor estrategia”.Y no solo aparece en promociones explícitas, el cigarrillo electrónico se puede ver en contenido audiovisual de todo tipo, incluidos canales de Youtube o Twich, que naturalizan su consumo. Streamers como El Rubius o AuronPlay, con millones de seguidores en estas plataformas (muchos de ellos menores), han aparecido en ellas vapeando (lo que no quiere decir que hayan cobrado por ello).Beatriz Arranz, técnica de Prevención y Promoción de la Salud de la Asociación Española Contra el Cáncer, explica que la industria continúa con una vieja técnica que parece funcionarle muy bien: “Lo relacionan con personas jóvenes, atractivas, guais. El significante social es el mismo que el del tabaco: fumo porque me parece guay, porque lo hacen personas a las que admiro, porque me ayuda a ligar, a hacer amigos, porque en mi grupo se percibe como positivo. Lo asocio con sensaciones que me van a ayudar a relajarme”.Eso argumenta Carla, de 19 años, que empezó en paralelo con el tabaco y el vapeo cuando tenía unos 15: “En periodos de mucho estrés uso más el vapeo. Y aunque sé que no es saludable, me parece menos sucio que el tabaco, que huele peor”. Explica que tiene rachas de más tabaco o más cigarrillo electrónico, pero que si tuviera que elegir uno solo se quedaría con este último por “olor y comodidad”.En el sector de la salud (sociedades científicas y plataformas antitabaco) consideran que la normativa debería equipararse a la del tabaco para restringir su promoción y los puntos de venta: los cigarrillos convencionales no podrían estar patrocinando festivales, anunciándose en redes, ni de venta en tiendas de barrio sin una licencia concreta, por ejemplo. En este sentido iba el borrador de la estrategia contra el tabaco que el Ministerio de Sanidad tiene guardado en un cajón desde hace más de un año. El Plan Integral de Prevención y Control del Tabaquismo 2021-2025 está sin aprobar y parece improbable que el departamento de Carolina Darias —que está a punto de dejar el puesto para presentarse a la alcaldía de Las Palmas por el PSOE— vaya a desempolvarlo antes del fin de la legislatura.Arranz se queja de que pueda pasar lo mismo que con el tabaco, que se relaciona con un tercio de todos los cánceres: “Igual que en los sesenta (en los ochenta las mujeres) una generación de fumadores comenzó sin conocer bien sus peligros y lo lamentaron unas décadas después, es posible que, si no hacemos nada, en 20 años estemos lamentando que uno de cada tres tumores tengan que ver con el vapeo”.Qué se sabe de los efectos para la salud del vapeoAl contrario del tabaco, cuyo residuo es un humo maloliente que se impregna en el cuerpo y la ropa de quienes lo fuman y de los que están a su alrededor, el cigarrillo electrónico genera un vapor de (según los gustos) agradables aromas. Pero “es engañoso”, según Arranz, porque realmente son aerosoles que contienen cancerígenos, metales pesados y diversas partículas nocivas para el organismo, incluso si no llevan nicotina.Los efectos a corto plazo en las vías respiratorias de estos dispositivos son “similares a los del tabaco”, según expone un informe de Sanidad publicado en 2022 que hace una revisión de toda la evidencia científica que hay al respecto. “Se han encontrado sustancias cancerígenas en líquidos y aerosol de los cigarrillos electrónicos. Se han descrito numerosas intoxicaciones y efectos adversos relacionados con estos productos, algunos de ellos severos. Su utilización genera emisión de propilenglicol, partículas PM 2.5 [partículas muy pequeñas que penetran en el organismo], nicotina y sustancias cancerígenas que pueden contaminar los espacios cerrados, con los consecuentes riesgos por exposición pasiva”, enumera.Es cierto que no está claro cuáles son los efectos a largo plazo, algo que no se podrá saber hasta que pasen décadas desde su implantación. Pero las sociedades científicas comparten el consenso de que no es razonable consumirlo ese tiempo para después luego medirlo, dados los riesgos obvios que ya se conocen.Más controvertido es hasta qué punto pueden servir para dejar de fumar, uno de los argumentos de parte de la industria para defender el producto. “Los cigarrillos electrónicos podrían reducir el deseo de fumar y otros síntomas característicos del abandono del tabaco. No obstante, aunque algunos fumadores podrían cambiar temporalmente el consumo de tabaco por estos productos, una proporción muy baja parece llegar a la cesación sostenida en este modo. Según los datos disponibles, no están claras a largo plazo ni la duración del cambio de consumo ni la cesación completa”, señala el documento de Sanidad.Los expertos del ministerio sí advierten del peligro que supone la promoción de estos productos, ya que “podrían incorporar a nuevos adictos a la nicotina”. Para muchos jóvenes y adolescentes, el vapeo no supone una salida del tabaco, sino más bien la puerta de entrada para comenzar a fumar.","‘Influencers’, tiendas de barrio y festivales: estrategias para crear una nueva generación de vapeadores",https://elpais.com/sociedad/2023-03-26/influencers-tiendas-de-barrio-y-festivales-las-estrategias-de-la-industria-para-crear-una-nueva-generacion-de-vapeadores.html,elpais,elpais.com,9,816
631c34e351a2e3db217b1ff082e92b13,"WhatsApp prepara una novedad para su aplicación de mensajería que permitirá grabar y enviar mensajes en un formato de vídeo breve. Las primeras pruebas de este nuevo sistema se han encontrado en la beta para el sistema operativo iOS, de Apple.La nueva herramienta replicará el funcionamiento de los mensajes de voz, pero a través de la cámara, para que los usuarios puedan grabar y enviar vídeos cortos de hasta 60 segundos, según ha informado el portalWABetainfo. Esta función específica para los videomensajes se ha localizado en el programa beta TestFlight para iOS, en la versión 23.6.0.73. Y, al contrario de lo que ocurre actualmente con el envío de cualquier vídeo a través de la app, esta novedad no permitirá guardar ni reenviar el videomensaje.Imagen del funcionamiento de los nuevos videomensajes en WhatsApp.wabetainfoEl portal especializado también ha indicado que los videomensajes estarán protegidos con la encriptación de extremo a extremo, impidiendo que terceros maliciosos puedan acceder a su contenido. La capacidad de enviar mensajes de vídeo está en desarrollo y se lanzará en una futura actualización de la aplicación, todavía sin definir.Puedes seguir a EL PAÍS Tecnología en Facebook y Twitter o apuntarte aquí para recibir nuestra newsletter semanal.",La nueva herramienta de WhatsApp: llegan los videomensajes que no pueden ser reenviados,https://elpais.com/tecnologia/2023-03-24/la-nueva-herramienta-de-whatsapp-llegan-los-videomensajes-que-no-pueden-ser-reenviados.html,elpais,elpais.com,8,97
