uid,body,title,url,newspaper_uid,host,n_tokens_title,n_tokens_body
a0803ac9f0c7168778f892975b5cfef8,"“Cuando entras a una casa, los objetos cuentan historias, cuentan tu vida. Nos dicen dónde has estado de viaje, si te gusta o no te gusta cocinar, si eres aficionado al tenis o si juegas al golf, si lees y qué lees, si escuchas música y qué música te gusta, si tienes o no hijos. Los objetos no mienten. Hace poco, estuvimos en una casa donde encontramos botes de farmacia, un microscopio, un vademécum y yo pregunté: ‘¿Médico o farmacéutico?’. Era médico”, cuenta a EL PAÍS Astrid Romero, quien, junto a su socia María López, fundó en 2018 Arquitectura del Orden, una empresa que se dedica a ordenar trastos para vaciar hogares, organizando mercadillos en las propias casas que necesitan liberar espacio y que funciona, principalmente, gracias al boca a boca y al crecimiento de su coqueta cuenta de Instagram, donde acumulan cerca de 31.000 seguidores.Nos encontramos en la última planta de un imponente edificio de la madrileña calle de Lagasca, un ático de grandes dimensiones y una deliciosa terraza por donde la luz entra a raudales, iluminando todos los rincones. Aquí dentro todo está patas arriba. Sobre la encimera de la cocina se exponen vajillas familiares, libros de cocina, pequeños y grandes electrodomésticos, cazuelas, bandejas, fuentes y morteros. En el salón, todavía dentro de una caja aunque lista para ser colocada en un lugar de preferencia, se encuentra una vajilla inglesa Spode del siglo XIX, de porcelana esmaltada en azul, a punto de ser instalada sobre una imponente mesa de madera maciza. También hay muebles y lámparas de estilo modernista, óleos con naturalezas muertas, divanes, sillas y sillones, jarrones con florituras, mesitas auxiliares de cristal, ceniceros, libros. En una de las habitaciones principales, encontramos sobre la cama sábanas, edredones y mantas, bordadas con las iniciales de la familia. Todo lo que hay alrededor—desde los cucharones de cocina hasta los abrigos que cuelgan en los armarios— está a la venta. En menos de tres días, una ingente cantidad de personas ajenas por completo a quienes habitaron entre estas paredes vendrán a llevarse un pedacito de su historia a precio de saldo.Más informaciónLa generación Z se pasa a la ropa de segunda mano: de una camisa de Ralph Lauren en el Rastro a unos Levi’s en una tienda ‘vintage’Los 'estate sales' son mercadillos organizados en las viviendas de los propietarios o sus herederos, donde absolutamente todo está a la venta. En la imagen, una mesa vestida para su venta por Astrid y María, de Arquitectura del Orden.Santi BurgosTodo comenzó de casualidad hace cinco años. Astrid Romero, periodista de formación, recibió la llamada de una amiga: su padre había fallecido y su viuda iba a mudarse a un piso más pequeño al que no podía llevarse todas sus cosas. Le propuso hacer un mercadillo de ropa: “Cuando llegué, me quedé alucinada. Aquello era un casoplón de mil metros cuadrados y la señora se mudaba a un piso de 180 metros. Les propuse hacer un mercadillo con todo”. Romero, que había pasado parte de su vida en Estados Unidos, estaba familiarizada con el concepto de estates sales: jornadas de puertas abiertas en casas donde el propietario o sus herederos venden gran parte de lo que hay dentro, si no todo. Esta idea va más allá de montar un simple mercadillo: “Es una ceremonia de despedida”, apunta Romero, “donde narramos la historia de la casa y sus propietarios a través de los objetos”. Para su primera jornada de puertas abiertas, Romero decidió llamar a una vieja amiga, María López, restauradora profesional especializada en muebles, para que le echase una mano con la valoración económica de los objetos. El fin de semana que organizaron el mercadillo, el boca a boca hizo que la cola diese la vuelta al chalet. El segundo día, Astrid y María colgaron un cartel: “Vaciamos tu casa”. Y surgió el negocio. A día de hoy ya han vaciado 53 viviendas, principalmente en Madrid, pero también en Segovia, Toledo o Alicante.En uno de los dormitorios de la vivienda encontramos las sábanas, mantas y edredones de la familia.Santi BurgosCuando Romero y López reciben una llamada, el primer paso es hacer una visita a la vivienda que van a vaciar. Ahí valoran si el conjunto de objetos que tienen a su alcance es susceptible de venderse: “Lo que para ti son trastos, para otros son tesoros”, afirma María López. “Lo más curioso de todo esto es que el dinero no está en un mueble aparador maravilloso o una gran mesa de comedor, el dinero está en el destornillador, en la cuchara de palo, en la fuente de barro, en los platos desparejados. Son cosas de las que nosotros nos ocupamos, pero sus dueños ya no les dan valor”.El dinero, explican desde Arquitectura del Orden, está en las pequeñas cosas: el destornillador, la cesta de pan, los platos desparejados.Santi BurgosEntre quienes se acercan a las jornadas de puertas abiertas buscando gangas o tesoros hay perfiles de todo tipo, no solo personas de clase media: “Por ejemplo, vienen muchos estudiantes que aprovechan estos mercadillos para hacerse con vajillas y utensilios de cocina”, explica Romero, “y también quienes coleccionan cartas o fotografías antiguas o que se dedican al collage”. Los precios también son parte de la atracción: “Nuestro objetivo es vaciar los pisos, así que trabajamos por debajo del mercado de segunda mano”, cuenta López.Un rincón de uno de los pisos donde se organizan las jornadas de puertas abiertas, con bandejas de plata.Santi BurgosAl contrario que en otros países como Estados Unidos —con sus estate sales o sus ventas en el garaje— o el Reino Unido —llena de charity shops, tiendas vintage y famosos mercadillos dedicados a productos usados—, en España la segunda mano se ha percibido tradicionalmente como “cutre”. “La mentalidad aquí siempre ha sido: ‘Si puedo permitirme comprar algo nuevo, ¿por qué comprarlo usado?”, apunta Astrid Romero. En los últimos años, la conciencia medioambiental y la búsqueda de un consumo más sostenible y responsable, sumado al auge de plataformas de compra venta de productos entre particulares como Wallapop (con 17 millones de usuarios al mes en España) o Vinted (seis millones), especializada en moda, han dado un giro a esta percepción. “La mentalidad del consumidor está cambiando”, afirma María López, “y cada vez somos más ecológicos y tenemos mayor conciencia sobre lo que compramos”. “Además, especialmente la gente joven, ha descubierto que gracias a la segunda mano puede permitirse tener cosas mejores”, apunta Romero, “¿para qué van a comprar la vajilla horrorosa de Ikea si en un mercadillo pueden tener una vajilla buena? ¿Para qué seguir gastando dinero en muebles hechos de forma encadenada? Esto es mucho más barato y, sin duda, mucho más ecológico”.Copas de ocasión en un céntrico piso de Madrid.Santi BurgosLa última barrera, quizá, es el apego. El filósofo italiano Remo Bodei definía los objetos como “nudos de relaciones con la vida de los demás, círculos de continuidad entre generaciones, puentes que conectan historias individuales y colectivas”. Quizás tener a más de 100 personas repartiéndose las memorias de un pasado familiar puede resultar chocante, incluso violento. El trabajo de Romero y López tiene mucho de psicología. Y ellas lo saben: “Nuestro trabajo, al final, es hacer ver a la familia que necesita vaciar su casa que esto tan solo son objetos: una vajilla, un cenicero de cristal, una silla. Son solo cosas. Y a la persona que viene al mercadillo, convencerla de todo lo contrario: esto no es una vajilla, un cenicero de cristal o una silla, son pedacitos de la vida de alguien. Las cosas no son solo cosas”, explica Romero. Parece que funciona.","Las mujeres que organizan mercadillos para vaciar pisos de lujo: “Lo que para ti son trastos, para otros son tesoros”",https://elpais.com/estilo-de-vida/2023-03-25/las-mujeres-que-organizan-mercadillos-para-vaciar-pisos-de-lujo-lo-que-para-ti-son-trastos-para-otros-son-tesoros.html,elpais,elpais.com,8,649
5407ef6e4734df6c3f36a8c0db345782,"Esta primavera se publica en España Una buena vida, que recoge el estudio científico más largo nunca realizado sobre la felicidad. Iniciado en 1939 por la Universidad de Harvard hasta hoy día, lo cual ha permitido englobar varias generaciones, se buscaba responder a la pregunta: ¿qué nos hace felices?En el libro que firman Robert Waldinger y Marc Schulz, que vio la luz en EE UU a principios de año, vemos las conclusiones de The Harvard Study of Adult Development [El estudio de Harvard sobre el desarrollo de los adultos], que siguió las vidas de sujetos de las mismas familias durante más de 80 años.Si nos vamos a tiempos recientes, dada la amplitud del estudio, en 2007 el 76% de los mileniales entrevistados sobre sus objetivos vitales pusieron en primer lugar “hacerse ricos” y la mitad incluyeron entre sus metas principales “volverse famosos”.Es interesante observar qué contestaron estas mismas personas 10 años más tarde, siendo ya adultos, al responder de nuevo a la pregunta. El deseo de fama había descendido ya en la lista, mientras que el dinero seguía siendo un tema importante con algunos matices. Además de aspirar a una carrera profesional de éxito, muchos entrevistados relacionaban la felicidad con “una vida sin deudas”. Llegar a ese deseo, tras haber ambicionado ser rico, refleja todo un baño de realidad.Conviene señalar que esta prolongada investigación se centró mayormente en la población masculina blanca de Boston, pero el valor del estudio es que los sujetos actualizaban datos de sus vidas de forma periódica. Esto ha permitido saber cómo las distintas circunstancias vitales, así como los hábitos personales, inciden en nuestro bienestar y felicidad.Al analizar los datos de ocho décadas, la conclusión a la que han llegado los investigadores es que lo que ha demostrado procurar felicidad duradera no es el dinero ni el éxito profesional. Tampoco el ejercicio o la dieta, aunque sin duda contribuyen en el bienestar.El factor número uno de la felicidad, según el estudio, es tener buenas relaciones. Las personas con una conexión más íntima con la familia, los amigos y la comunidad son más felices y, además, gozan de mejor salud.Para medir la calidad relacional, el cuestionario de Harvard de 1989 que recibieron los participantes fue este:Piensa en tus 10 mejores amigos (excluyendo familia y parientes cercanos). ¿Cuántos de ellos pondrías en las siguientes categorías?1. Íntimos. Compartimos la mayor parte de nuestras alegrías y tristezas.2. Compañeros. Interactuamos de forma frecuente a partir de intereses compartidos.3. Puntuales. No nos buscamos de forma expresa.Las personas que demostraron ser más felices a lo largo del tiempo fueron las que cultivaron la primera categoría de amigos.Es curioso observar que durante la adolescencia y primera juventud tendemos a cuidar mucho nuestra tribu de amistades íntimas. Esta puede ser una de las razones por las que contemplamos esa época con nostalgia. A medida que asumimos responsabilidades adultas, las amistades van quedando relegadas a un segundo o tercer plano. El trabajo y otros compromisos acaban adueñándose de todos los huecos, y entonces surge la excusa de que “no hay tiempo” para una actividad tan vital.IN ENGLISHWhat makes us happy? Spoiler alert: it’s not moneySegún los autores de Una buena vida, “los amigos nos pueden rescatar cuando estamos en horas bajas, nos proporcionan una importante conexión con nuestra propia historia y, quizás lo más importante de todo, nos hacen reír. A veces no hay nada tan beneficioso para la salud como pasarlo bien”.Nuestra necesidad de conexiones humanas de calidad ha sido fundamental en la evolución y supervivencia de nuestra especie, señalan Waldinger y Schulz. Desde que éramos cazadores recolectores, tener una tribu propia nos ha dado protección frente a los peligros de la vida. En los tiempos actuales, podríamos incluir entre esos peligros los trastornos del estado de ánimo que afectan a gran parte de la población.Nunca es tarde para la felicidad si empezamos a administrar vitamina R, de relaciones, a nuestra vida. Para ello, hay que darle prioridad sobre muchas otras obligaciones y compromisos. Esta será nuestra mejor inversión porque, como demuestra el estudio de Harvard, quien no tiene tiempo para los amigos, no tiene tiempo para ser feliz.El proyecto SUNTambién en España hay estudios sobre el bienestar humano. En 1999 empezó el Proyecto SUN (Seguimiento Universidadde Navarra), que actualmente cuenta con más de 22.500 participantes, a los que se suman 2.000 nuevos cada año. Cada dos años, los participantes reciben un nuevo cuestionario para ir midiendo la progresión. Esto permite a los investigadores estudiar las causas de la depresión, pero también las de la obesidad, las enfermedades cardiovasculares o la hipertensión, entre otras. Uno de los sujetos que se han prestado a este estudio es el doctor en Psicología Andrés Martín Asuero, quien, tras leer los resultados de la investigación de Harvard, opina que una forma práctica de mejorar nuestra vida es fomentando nuestras relaciones. “Si no entendemos lo que nos hace felices, podemos terminar eligiendo trabajos bien remunerados que nos alejan de nuestra familia o amistades”, insiste.Francesc Miralles es escritor y periodista experto en psicología.Suscríbete para seguir leyendoLee sin límitesSeguir leyendoYa soy suscriptor",¿Qué nos hace felices? ‘Spoiler’: no es el dinero,https://elpais.com/eps/2023-03-22/que-nos-hace-felices-spoiler-no-es-el-dinero.html,elpais,elpais.com,4,431
eca02636dd386b650779f7447a8439e9,"¿Escuchar un audiolibro es equivalente a leerlo? ¿Hago trampas si llego a mi club de lecturas con la novela escuchada en lugar de leída? Dice Daniel Willingham, profesor del Departamento de Psicología de la Universidad de Virginia y autor de The Reading Mind: A Cognitive Approach to Understanding How the Mind Reads (La mente lectora: una aproximación cognitiva para entender cómo lee la mente; sin edición en español), que estas son las preguntas que más tiene que contestar desde que, después de hacer muchos experimentos en su laboratorio y escribir un libro, se le considera un experto en la materia. El profesor Willingham suele responder con una fórmula salomónica: leer no es superior a escuchar, pero tampoco es equivalente.Más información¿Tiene sentido entrenarse para leer a toda prisa?Un estudio de 2010 se cita como clásico en estas comparaciones. En el experimento se midió lo que recordaba un grupo de estudiantes después de escuchar un podcast de 22 minutos sobre una materia científica y se comparó con otro grupo que había estudiado lo mismo a partir de un texto impreso. A pesar de que ambos grupos habían dedicado el mismo tiempo al material, dos días más tarde los lectores recordaban el 81% del tema, mientras que los oyentes solo habían retenido el 59% de lo escuchado.Los autores explicaban la diferencia porque se trataba de una materia compleja, de difícil comprensión. Quizás, si ambos grupos hubieran leído o escuchado un relato de aventuras o una novela negra, hubieran recordado todo el argumento. En el experimento, el objetivo era aprender, no pasar el rato, y esta motivación lo cambia todo. “Cuando estamos concentrados y aprendiendo vamos más despacio, releemos las partes difíciles, retrocedemos. Todo esto se hace más fácil en un texto que en un audio”, explica el profesor en su libro. Las investigaciones de Trish L. Varao Sousa, de la Universidad de Waterloo en Ontario (Canadá) también concluyen que aunque escuchar pueda resultar atractivo y conveniente —es compatible con los altos niveles multitarea de la vida moderna—, es la opción menos adecuada para aprender porque “genera tasas más altas de divagación mental”.Si quieres apoyar la elaboración de periodismo de calidad, suscríbete.SuscríbeteEn otro experimento de 2018 con estudiantes de instituto, publicado en la revista Scholarship of Teaching and Learning in Psychology, se demostró que los participantes recordaban mejor un pasaje leído que uno escuchado. En un texto impreso, el lector está más orientado que en un audio. Algunas referencias físicas como los espacios entre párrafos, los puntos y aparte, las capitulares, incluso la textura de las páginas, la cubierta del libro y el grosor del ejemplar suponen una ventaja para recordar. Incluso algunos expertos creen que para estudiar es más eficaz leer en papel que en formato digital, donde el lector se pierde en un scrolling interminable de contenido uniforme donde cada página se parece demasiado a la anterior.Para todo lo demás, el audio se impone, moderno e imbatible. Se adapta a todo, acompaña y permite que la literatura conquiste parcelas de la vida que antes le estaban negadas. Se puede escuchar una novela mientras uno se pudre en un atasco, viaja en metro o practica deporte. La comprensión del contenido, aunque quizás no su recuerdo, es similar, y no hay que dedicarle toda la atención. Se demostró en 1977 en un estudio que se considera un clásico en la materia, Summarizing stories after reading and listening (Resumiendo relatos después de leerlos y escucharlos) . Luego, en 2016, otro trabajo, Does modality matter? (¿Importa el modo?) confirmó la hipótesis: no había diferencias en la comprensión entre lo leído y lo escuchado, sobre todo cuando se trataba de narrativas con un desenlace más o menos predecible y con ideas familiares expuestas en una progresión lógica.La neurocientífica Kristen Willeumier, autora de Biohack Your Brain, explica en su libro que leer y escuchar son actividades que mantienen el cerebro en un alto nivel de actividad. “La diferencia reside en el modo en que se activan los hemisferios cerebrales. Cuando leemos, trabaja el izquierdo, vinculado al procesamiento del lenguaje. Sin embargo, cuando escuchamos, ambos hemisferios permanecen activos para procesar el habla y la escucha. Esto significa que la información se procesa en las mismas áreas corticales, aunque la entrada provenga de la lectura o de un audio”.El científico Kepa Paz- Alonso, investigador del BCBL (Basque Center on Cognition, Brain and Language) y experto en neurociencia cognitiva, confirma la hipótesis de que en ambos casos la información se procesa en las mismas áreas, y lo hace con un audio de WhatsApp, porque le parece “más rápido y conveniente”. Dice: “En nuestros laboratorios comprobamos en chino, hebreo, inglés y castellano, cuatro lenguas muy distintas en sus códigos de escritura, que la lectura parasita las redes neuronales que ya existen en el cerebro para la comunicación oral”.A partir de ahí, considerar intelectual o moralmente superior al que lee respecto al que escucha un audiolibro le parece a Paz-Alonso “una idea vieja”. “Hace 150 años la lectura era una habilidad adquirida que separaba a las clases sociales, pero hoy, desde un punto de vista pragmático, las herramientas de escucha suponen un ahorro de tiempo y tienen claras ventajas”.La más obvia es que mientras escuchas un libro, las manos y los ojos quedan libres, y eso permite que la literatura sea compatible con actividades rutinarias como andar o poner una lavadora. Es una de las razones de la explosión del formato en España. Según Audible, la plataforma de audiolibros de Amazon, los datos de los últimos dos años (operan aquí desde 2020) muestran que cada mes se superan 1,4 millones de horas escuchadas de libros. Su catálogo en español se ha duplicado y hoy cuenta con 6.700 títulos.Otra ventaja de escuchar libros es que puede mejorar la compresión de palabras inusuales de la obra original. Si el narrador es bueno con las entonaciones y las declinaciones de palabras, los textos clásicos como los de Shakespeare parecen más fáciles de entender que cuando los leemos en silencio en la soledad de nuestra habitación. Además, la emoción del narrador genera empatía e intimidad hacia los personajes de la historia. Si se activan los circuitos emocionales del cerebro y empezamos a imaginar, podemos disfrutar mucho más que leyendo.Los defensores de la lectura tradicional apuntan a un mal hábito de nuestra época: acelerar los audios y alterar el tempo de la narración para consumir más cantidad de contenidos. “Pero ¿es que acaso eso no se hace leyendo un texto?”, se pregunta Paz-Alonso, que recuerda que hay lectores muy rápidos que leen en diagonal o escanean frases enteras.Contra lo que podemos pensar, leer un libro es una actividad más rápida que escucharlo. Según la plataforma VirtualSpeech, la mayoría de los podcasters y narradores pronuncian entre 150 y 160 palabras por minuto, mientras que cuando leemos solemos consumir en ese mismo tiempo entre 300 y 400 palabras. Si nos impacientamos más cuando escuchamos un libro que cuando lo leemos es porque solemos consumir los audiolibros en un estado acelerado de multitarea, por ejemplo, en medio de un atasco. Y queremos que pasen cosas o, ya puestos, que acabe todo de una vez (el atasco y, de paso, la historia). Casi nadie escucha un audiolibro en estado de calma, concentrado y en silencio. Y es muy probable que muchos sí sigan leyendo así.Leer un libro o escucharlo son dos actos que difícilmente se solapan. Cada uno tiene sus usos bien definidos. Es posible que alguien vaya en el metro escuchando un manual de Phyton (un lenguaje de programación), pero no será la práctica más habitual.El profesor Daniel Willingham terminó escribiendo un artículo en The New York Times para tranquilizar a todos los que se sentían impostores por no leer y en su lugar escuchar un audiolibro antes de ir a su club de lectura: “No, no hacéis trampa, solo estáis teniendo una experiencia diferente”. Lo de leer o escuchar a Cervantes sigue siendo un asunto sin resolver.Apúntate aquí a la newsletter semanal de Ideas.Suscríbete para seguir leyendoLee sin límitesSeguir leyendoYa soy suscriptor",¿Libro o audiolibro? Esa no es la cuestión,https://elpais.com/ideas/2023-03-24/libro-o-audiolibro-esa-no-es-la-cuestion.html,elpais,elpais.com,2,670
